<?xml version="1.0" encoding="UTF-8" standalone="no"?>
<TouristVouchers xmlns:xsi="http://www.w3.org/2001/XMLSchema-instance" xsi:schemaLocation="http://www.karach.com/tourist-voucher TouristVoucher.xsd" xmlns="http://www.karach.com/tourist-voucher">
    <TouristVoucher ID="379" currency="EUR">
        <Type>vacation</Type>
        <Country>Spain</Country>
        <MinDays>7</MinDays>
        <MaxDays>8</MaxDays>
        <Transport>Plane</Transport>
        <HotelCharacteristics>
            <Stars>5</Stars>
            <Food>All Inclusive</Food>
            <RoomType>DOUBLE</RoomType>
            <Amenities>included</Amenities>
        </HotelCharacteristics>
        <Cost>5000.0</Cost>
        <StartDate>2023-11-20T19:47:15.006254200Z</StartDate>
    </TouristVoucher>
    <TouristVoucher ID="830" currency="EUR">
        <Type>excursion</Type>
        <Country>Poland</Country>
        <MinDays>2</MinDays>
        <MaxDays>3</MaxDays>
        <Transport>Bus</Transport>
        <HotelCharacteristics>
            <Stars>2</Stars>
            <Food>BB</Food>
            <RoomType>SINGLE</RoomType>
            <Amenities>included</Amenities>
        </HotelCharacteristics>
        <Cost>500.0</Cost>
        <StartDate>2023-11-20T19:47:15.014232300Z</StartDate>
    </TouristVoucher>
    <TouristVoucher ID="930" currency="USD">
        <Type>weekend</Type>
        <Country>Spain</Country>
        <MinDays>7</MinDays>
        <MaxDays>14</MaxDays>
        <Transport>Plane</Transport>
        <HotelCharacteristics>
            <Stars>4</Stars>
            <Food>HB</Food>
            <RoomType>DOUBLE</RoomType>
            <Amenities>included</Amenities>
        </HotelCharacteristics>
        <Cost>3000.0</Cost>
        <StartDate>2023-11-20T19:47:15.014232300Z</StartDate>
    </TouristVoucher>
    <TouristVoucher ID="258" currency="ILS">
        <Type>pilgrimage</Type>
        <Country>Israel</Country>
        <MinDays>14</MinDays>
        <MaxDays>21</MaxDays>
        <Transport>Diverse</Transport>
        <HotelCharacteristics>
            <Stars>3</Stars>
            <Food>All Inclusive</Food>
            <RoomType>DOUBLE</RoomType>
            <Amenities>included</Amenities>
        </HotelCharacteristics>
        <Cost>10000.0</Cost>
        <StartDate>2023-11-20T19:47:15.014232300Z</StartDate>
    </TouristVoucher>
</TouristVouchers>
